Название книги;Автор книги;Издатель книги;Цена со скидкой;Цена без скидки;Скидка
Параллельное программирование на C++ с помощью библиотеки TBB;Восс;ДМК-Пресс:;1 741;3 869;–55 %
Предметно-ориентированное проектирование в Enterprise Java;Наир Виджей;ДМК-Пресс:;1 161;2 580;–55 %
Генеративное глубокое обучение. Творческий потенциал нейронных сетей;Фостер Дэвид;Питер:Бестселлеры O`Reilly;2 086;2 674;–22 %
Анализ данных при помощи Microsoft Power BI и Power Pivot для Excel;Феррари;ДМК-Пресс:;1 219;2 709;–55 %
Распределенные системы реального времени. Теория и практика;Эрджиес Кайхан;ДМК-Пресс:;1 393;3 095;–55 %
Программирование на Python. Базовый курс;Седжвик;Вильямс:;1 972;4 383;–55 %
Нативная разработка мобильных приложений. Перекрестный справочник для iOS и Android;Льюис;ДМК-Пресс:;1 161;2 580;–55 %
Паттерны объектно-ориентированного проектирования;Гамма;Питер:Библиотека программиста;943;1 209;–22 %
Применение пакета MATLAB и SIMULINK для анализа электрических цепей. Том 1;Фриск;Солон-пресс:Библиотека студента;697;1 549;–55 %
Управление памятью в .NET для профессионалов;Кокоса Конрад;ДМК-Пресс:;2 653;5 895;–55 %
Исследование операций и методы оптимизации. Учебное пособие;Болотский;Лань:Учебники для вузов. Специальная литература;320;710;–55 %
Веб-компоненты в действии;Фаррелл Бен;ДМК-Пресс:;1 277;2 837;–55 %
Машинное обучение на R: экспертные техники для прогностического анализа;Ланц Бретт;Питер:Библиотека программиста;2 669;3 422;–22 %
Head First. Изучаем Go;Макгаврен Джей;Питер:Head First (O'Reilly);2 942;3 772;–22 %
Глубокое обучение. Погружение в мир нейронных сетей;Николенко;Питер:Библиотека программиста;1 424;1 826;–22 %
Архитектура компьютерных систем. Курс лекций. Учебное пособие;Белугина Светлана Викторовна;Лань:Учебники для вузов. Специальная литература;734;1 630;–55 %
Основы программирования информационного контента. Учебное пособие;Быкадорова;Лань:Учебники для вузов. Специальная литература;403;895;–55 %
Численные методы. Учебник;Слабнов Виктор Дмитриевич;Лань:Учебники для вузов. Специальная литература;2 426;5 390;–55 %
Введение в глубокое обучение;Черняк Евгений;Вильямс:;934;2 075;–55 %
Машинное обучение без лишних слов;Бурков Андрей;Питер:Библиотека программиста;1 327;1 701;–22 %
Легкий способ выучить Python 3 еще глубже;Шоу Зед А.;Эксмо-Пресс:Мировой компьютерный бестселлер (обложка);880;1 206;–27 %
Практикум по численным методам в вычислительных средах matlab и mathcad. Учебное пособие;Бастрон;РГГУ:;407;905;–55 %
Программирование на языке Пролог для задач искусственного интеллекта. Введение в логическое программ;Ефимова Елена Анатольевна;РГГУ:;500;1 110;–55 %
Информационные системы и программирование. Специалист по информационным системам. Выпускная квалифик;Логачев Максим Сергеевич;ИНФРА-М:Среднее профессиональное образование;2 286;5 081;–55 %
Совершенный алгоритм. Жадные алгоритмы и динамическое программирование;Рафгарден Тим;Питер:Библиотека программиста;1 440;1 846;–22 %
SCALA для нетерпеливых;Хостманн Кей;ДМК-Пресс:Функциональное программирование;1 044;2 321;–55 %
Обучение с подкреплением;Саттон;ДМК-Пресс:;2 322;5 159;–55 %
Рекомендательные системы на практике;Фальк Ким;ДМК-Пресс:;1 294;2 875;–55 %
Flutter на практике. Прокачиваем навыки мобильной разработки с помощью открыт. фреймворка от Googlе;Заметти Франк;ДМК-Пресс:;1 422;3 161;–55 %
Java Concurrency на практике;Гетц;Питер:Для профессионалов;1 558;1 998;–22 %
C# 8.0. Карманный справочник;Албахари;Диалектика:;1 030;2 288;–55 %
Нейронные сети и глубокое обучение. Учебный курс;Аггарвал Чару;Вильямс:;3 858;8 574;–55 %
Разработка веб-приложений с помощью Node.js, MongoDB и Angular. Исчерпывающее руководство;Дейли;Вильямс:;3 258;7 240;–55 %
Разработка игр на Unity 2018 за 24 часа;Гейг Майк;Бомбора:Мировой компьютерный бестселлер;1 772;2 427;–27 %
R. Книга рецептов. Проверенные рецепты для статистики, анализа и визуализации;Лонг;ДМК-Пресс:;1 857;4 127;–55 %
Графовые алгоритмы. Практическая реализация на платформах  Apache Spark и Neo4j;Нидхем;ДМК-Пресс:;1 161;2 580;–55 %
Функциональное программирование на С++. Как сделать свои программы изящными с помощью технологии фун;Чукич Иван;ДМК-Пресс:;1 393;3 095;–55 %
Теория автоматического управления (с использованием MATLAB-SIMULINK). Практикум. Учебное пособие;Пащенко;Лань:Учебники для вузов. Специальная литература;1 153;2 563;–55 %
Python. Непрерывная интеграция и доставка;Ленц Мориц;ДМК-Пресс:;638;1 417;–55 %
Программирование GPU при помощи Python и CUDA. Исследуйте высокопроизводительные параллельные вычисл;Тоуманнен Бриан;ДМК-Пресс:;1 044;2 321;–55 %
Разработка с использованием квантовых компьютеров;Силва Владимир;Питер:Библиотека программиста;1 962;2 516;–22 %
Изучаем Python. Программирование игр, визуализация данных, веб-приложения;Мэтиз Эрик;Питер:Библиотека программиста;1 512;1 938;–22 %
Java. Библиотека профессионала. Том 2. Расширенные средства программирования;Хорстманн Кей С.;Вильямс:;3 858;8 574;–55 %
Изучаем Python. Том 2;Лутц Марк;Вильямс:;2 955;6 567;–55 %
Волшебство Kotlin;Симон Пьер-Ив;ДМК-Пресс:;1 509;3 354;–55 %
Методы и алгоритмы решения прикладных задач дискретной оптимизации. Учебное пособие;Карпов;Солон-пресс:Библиотека профессионала;454;1 008;–55 %
Обработка естественного языка с TensorFlow;Ганегедара Тушан;ДМК-Пресс:;1 393;3 095;–55 %
Информационные системы и программирование. Администратор баз данных. Учебник;Логачев Максим Сергеевич;ИНФРА-М:Среднее профессиональное образование;1 750;3 888;–55 %
Программное обеспечение компьютерных сетей. Учебное пособие;Исаченко Олег Вячеславович;ИНФРА-М:Среднее профессиональное образование;700;1 556;–55 %
Моделирование химико-технологических процессов. Принципы применения пакетов компютерн. математики;Гартман;Лань:Учебники для вузов. Специальная литература;2 049;4 554;–55 %
Клиентские технологии веб-программирования: JavaScript и DOM;Диков Андрей Валентинович;Лань:Учебники для вузов. Специальная литература;768;1 706;–55 %
Изучаем Angular 2;Дилеман Пабло;ДМК-Пресс:;813;1 806;–55 %
Разработка обслуживаемых программ на языке C#;Виссер Джуст;ДМК-Пресс:;522;1 161;–55 %
10 практических устройств на AVR-микроконтроллерах. Книга 1 (+CD);Кравченко Алексей Владимирович;Корона-Принт:;293;650;–55 %
XBRL для чайников;Хоффман;"Диалектика:Для ""чайников""";1 789;3 976;–55 %
Разработка геоприложений на языке Python;Вестра Эрик;ДМК-Пресс:;1 422;3 161;–55 %
Инженерия требований;Халл;ДМК-Пресс:;813;1 806;–55 %
Программирование PIC - микроконтроллеров на PicBasic;Хелибайк Чак;Додека XXI век:Программируемые системы;582;1 294;–55 %
Введение в современные САПР. Курс лекций;Малюх Владимир Николаевич;ДМК-Пресс:САПР от А до Я;410;911;–55 %
Функциональное программирование на F#;Сошников Дмитрий Валерьевич;ДМК-Пресс:;410;911;–55 %
Скользкие места С++. Как избежать проблем  при проектировании и компиляции ваших программ;Дьюхэрст Стефан К.;ДМК-Пресс:Профессиональная серия от Addison-Wesley;522;1 161;–55 %
Программируем микрокомпьютер NXT в LabVIEW;Белиовская;ДМК-Пресс:Все о LabVIEW;453;1 006;–55 %
Dart в действии;Баккет Крис;ДМК-Пресс:;1 219;2 709;–55 %
MATLAB. Полный самоучитель;Дьяконов Владимир Павлович;ДМК-Пресс:;1 161;2 580;–55 %
С для программистов с введением в С11;Дейтел;ДМК-Пресс:;970;2 155;–55 %
Параллельное и конкурентное программирование на Haskell;Марлоу Саймон;ДМК-Пресс:Функциональное программирование;1 035;2 301;–55 %
Практическое использование Common Lisp;Сайбель Питер;ДМК-Пресс:Функциональное программирование;1 164;2 587;–55 %
Сбор данных в Интернете на языке R;Храмов Дмитрий Александрович;ДМК-Пресс:;753;1 674;–55 %
Unity 5.x. Программирование искусственного интеллекта в играх;Паласиос Хорхе;ДМК-Пресс:;813;1 806;–55 %
Программирование микроконтроллеров. Стратегия и тактика;Матюшин Андрей Олегович;ДМК-Пресс:;929;2 064;–55 %
Ruby on Rails для начинающих. Изучаем разработку веб-приложений на основе Rails;Хартл Майкл;ДМК-Пресс:;1 509;3 354;–55 %
Программирование и отладка С/С++ приложений для микроконтроллеров ARM;Магда Юрий Степанович;ДМК-Пресс:;582;1 294;–55 %
Эффективное использование С++. 55 верных способов улучшить структуру и код ваших программ;Мэйерс Скотт;ДМК-Пресс:Профессиональная серия от Addison-Wesley;646;1 436;–55 %
Assembler. Для DOS, Windows и Unix;Зубков Сергей Владимирович;ДМК-Пресс:Для программистов;970;2 155;–55 %
Лямбда-выражения в Java 8. Функциональное программирование - в массы;Уорбэртон Ричард;ДМК-Пресс:Функциональное программирование;517;1 148;–55 %
Системная инженерия. Принципы и практика;Косяков;ДМК-Пресс:;1 552;3 449;–55 %
Оптимизация приложений на платформе .Net;Голдштейн;ДМК-Пресс:;1 044;2 321;–55 %
Интерфейс. Основы проектирования взаимодействия;Купер;Питер:Для профессионалов;2 076;2 662;–22 %
Аналоговые интерфейсы микроконтроллеров;Болл Стюарт Р.;Додека XXI век:Программируемые системы;696;1 547;–55 %
Практическое использование Vim. Редактируйте текст со скоростью мысли;Нейл Дрю;ДМК-Пресс:;1 164;2 587;–55 %
Анализ сетей (графов) в среде R. Руководство пользователя;Люк Дуглас А.;ДМК-Пресс:;1 359;3 019;–55 %
Основы проектирования в Autodesk Inventor 2016;Зиновьев Дмитрий Валериевич;ДМК-Пресс:;466;1 035;–55 %
Bootstrap в примерах;Морето Сильвио;ДМК-Пресс:;813;1 806;–55 %
Изучай Haskell во имя добра!;Липовача Миран;ДМК-Пресс:;1 164;2 587;–55 %
Matlab & Simulink. Проектирование мехатронных систем на ПК. Учебное пособие для ВУЗов + CD;Герман-Галкин Сергей Германович;Корона-Принт:Учебное пособие;332;737;–55 %
10 практических устройств на AVR-микроконтроллерах. Книга 2 +CD;Кравченко Алексей Владимирович;Корона-Принт:;293;650;–55 %
Вычислительная геометрия. Алгоритмы и приложения;Де;ДМК-Пресс:;1 393;3 095;–55 %
Разработка веб-приложений в ReactJS;Хортон;ДМК-Пресс:;813;1 806;–55 %
Введение в статистическое обучение с примерами на языке R;Джеймс;ДМК-Пресс:;1 741;3 869;–55 %
Современное программирование с нуля!;Потопахин Виталий Валерьевич;ДМК-Пресс:Учебное пособие;410;911;–55 %
Программирование на языке Lua;Иерузалимски Роберту;ДМК-Пресс:;1 099;2 443;–55 %
Android NDK. Руководство для начинающих;Ретабоуил Сильвен;ДМК-Пресс:;911;2 024;–55 %
Скрапинг веб-сайтов с помощью Python. Сбор данных из современного интернета;Митчелл Райан;ДМК-Пресс:;753;1 674;–55 %
PIC-микроконтроллеры: архитектура и программирование;Предко Майкл;ДМК-Пресс:;696;1 547;–55 %
Моделирование антенных устройств в Matlab с использованием пакета расширения Antenna Toolbox;Типикин А. А.;Солон-пресс:;311;690;–55 %
Управление электронными устройствами на С++. Разработка практических приложений;Катупития;ДМК-Пресс:;813;1 806;–55 %
C# 6.0. Справочник. Полное описание языка;Албахари;Вильямс:;2 955;6 567;–55 %
LabVIEW: стиль программирования;Блюм Питер;ДМК-Пресс:LabVIEW;582;1 294;–55 %
Искусство автономного тестирования с примерами на С#;Ошероув Рой;ДМК-Пресс:;1 035;2 301;–55 %
Графовые базы данных. Новые возможности для работы;Робинсон;ДМК-Пресс:;970;2 155;–55 %
Руководство по микропроцессорному обеспечению;Информация не найдена;ДМК-Пресс:;813;1 806;–55 %
Чисто функциональные структуры данных;Окасаки Крис;ДМК-Пресс:;696;1 547;–55 %
Программирование компьютерного зрения на языке Python;Солем Ян Эрик;ДМК-Пресс:;929;2 064;–55 %
UML Проектирование систем реального времени, распределенных и параллельных приложений;Гома Хассан;ДМК-Пресс:;1 451;3 224;–55 %
Периферийные устройства: интерфейсы, схемотехника, программирование;Авдеев Вадим Александрович;ДМК-Пресс:Все о радиоэлектронике;1 044;2 321;–55 %
R в действии. Анализ и визуализация данных на языке R;Кабаков Роберт И.;ДМК-Пресс:;1 161;2 580;–55 %
Анализ больших наборов данных;Лесковец;ДМК-Пресс:;1 552;3 449;–55 %
Построение компиляторов;Вирт Никлаус;ДМК-Пресс:;580;1 289;–55 %
Современный PHP. Новые возможности и передовой опыт;Локхарт Джош;ДМК-Пресс:;753;1 674;–55 %
MATLAB. Теория и практика;Гилат Амос;ДМК-Пресс:;1 277;2 837;–55 %
Параллельное программирование на С++ в действии. Практика разработки многопоточных программ;Уильямс Энтони;ДМК-Пресс:;1 552;3 449;–55 %
Рефакторинг кода на JavaScript. Улучшение проекта существующего кода;Фаулер Мартин;Вильямс:;3 500;7 778;–55 %
Язык программирования Python: практикум. Учебное пособие;Жуков Роман Александрович;ИНФРА-М:Среднее профессиональное образование;957;2 126;–55 %
Машинное обучение и безопасность. Защита систем с помощью данных и алгоритмов;Чио;ДМК-Пресс:;1 219;2 709;–55 %
Разработка интеллектуальных систем. Введение в технологию машинного обучения;Хултен Джефф;ДМК-Пресс:;1 044;2 321;–55 %
Теория вероятностей и математическая статистика в среде MATLAB. Учебное пособие;Алибеков Игорь Юсупович;Лань:Учебники для вузов. Специальная литература;871;1 936;–55 %
Экстремальное программирование. Разработка через тестирование;Бек Кент;Питер:Библиотека программиста;1 106;1 418;–22 %
Объектно-ориентированное программирование с примерами на C#. Учебное пособие;Хорев Павел Борисович;Форум:Среднее профессиональное образование;1 097;2 437;–55 %
Применение пакета MATLAB для анализа резонансных явлений в электрических цепях. Учебно-мет. пособие;Информация не найдена;Солон-пресс:Библиотека студента;224;498;–55 %
Применение пакета MATLAB для анализа резонансных явлений в электрических цепях. Учебно-мет. пособие;Информация не найдена;Солон-пресс:Библиотека студента;475;1 055;–55 %
Программирование. Сборник задач. Учебное пособие;Архипов;Лань:Учебники для вузов. Специальная литература;1 254;2 786;–55 %
Python. Книга Рецептов;Бизли;ДМК-Пресс:;2 090;4 644;–55 %
Глубокое обучение с подкреплением на Python. OpenAI Gym и TensorFlow для профи;Равичандиран Судхарсан;Питер:Библиотека программиста;1 359;1 742;–22 %
Грокаем глубокое обучение;Траск Эндрю;Питер:Библиотека программиста;1 101;1 411;–22 %
Практика реактивного программирования в SPRING 5;Докука;ДМК-Пресс:;1 741;3 869;–55 %
Как программировать на С;Дейтел;Бином:;913;2 028;–55 %
Нейросетевые методы в обработке естественного языка;Гольдберг Йоав;ДМК-Пресс:;1 393;3 095;–55 %
Предиктивное моделирование на практике;Кун;Питер:Для профессионалов;2 503;3 209;–22 %
Микросервисы. Паттерны разработки и рефакторинга;Ричардсон Крис;Питер:Библиотека программиста;2 028;2 600;–22 %
Системы счисления, алгоритмизация и программирование. Учебное пособие;Игнашева Елена Петровна;ИНФРА-М:Военное образование;957;2 126;–55 %
Объектно-ориентированное программирование. Учебник;Барков Игорь Александрович;Лань:Учебники для вузов. Специальная литература;2 654;5 898;–55 %
Практическое введение в программную инженерию. Учебное пособие;Волк Владимир Константинович;Лань:Учебники для вузов. Специальная литература;819;1 821;–55 %
Проектирование цифровых устройств на ПЛИС. Учебное пособие;Ушенина Инна Владимировна;Лань:Учебники для вузов. Специальная литература;1 425;3 167;–55 %
Введение в технологии контейнеров и Kubernetes;Маркелов Андрей Александрович;ДМК-Пресс:;696;1 547;–55 %
Логическое проектирование и верификация систем на SystemVerilog;Дональд Томас;ДМК-Пресс:;1 393;3 095;–55 %
HTML5 и CSS3 для чайников;Титтел;"Диалектика:Для ""чайников""";1 400;3 112;–55 %
C# для чайников;Мюллер;"Диалектика:Для ""чайников""";1 972;4 383;–55 %
Изучаем TypeScript 3;Розенталс Натан;ДМК-Пресс:;1 625;3 611;–55 %
Введение в веб-разработку на языке JavaScript. Учебное пособие;Государев Илья Борисович;Лань:Учебники для вузов. Специальная литература;972;2 160;–55 %
